{
   "id": "LSN-CON-02013",
   "version": 1,
   "kind": "concept",
   "target_id": "BC-CON-02013",
   "status": "draft",
   "snapshot_digest": "00839b8c36a7c5d46e3c3d2386e9f5665283703b31c30eedff1ab54062911e92",
   "source_digest": "5431c32220908b2b08e57ab2ebdd4923947d38dd728737710ccadfd637f5d5ab",
   "read_minutes": {
      "full": 4.0,
      "brief": 2.5
   },
   "word_count": {
      "full": 561,
      "brief": 342
   },
   "sections": [
      {
         "id": "LSN-CON-02013#s1",
         "type": "orientation",
         "bands": [
            "low",
            "mid"
         ],
         "skills": [
            "BC-SKL-02036",
            "BC-SKL-02037",
            "BC-SKL-02038"
         ],
         "sources": [
            "ced:67"
         ],
         "evidence_tag": "inferred",
         "text": "A response shows the derivative of a product as two terms added: the first factor times the derivative of the second, and the second factor times the derivative of the first. Questions ask for it symbolically or from values at a point.",
         "delivery": {
            "mode": "text",
            "reason": "rule 5: a symbolic rule, BC-REP-01 givens on BC-SKL-02036"
         }
      },
      {
         "id": "LSN-CON-02013#s2",
         "type": "key_ideas",
         "bands": [
            "low",
            "mid"
         ],
         "skills": [
            "BC-SKL-02036",
            "BC-SKL-02037",
            "BC-SKL-02038"
         ],
         "sources": [
            "ced:67"
         ],
         "evidence_tag": "verified",
         "ek_id": "BC-EK-FUN-3B1",
         "depth": "core",
         "text": "For a product \\(fg\\) the derivative is \\(f'g+fg'\\) (BC-EK-FUN-3B1, ced:67). It is not \\(f'g'\\), which expanding a simple product and differentiating term by term shows at once. A product of polynomials can also be expanded first, which is sometimes shorter.",
         "notation": "product rule",
         "quote": {
            "text": "Derivatives of products of differentiable functions can be found using the product rule.",
            "source": "ced:67"
         },
         "delivery": {
            "mode": "text",
            "reason": "rule 5: an algebraic identity with no figure-bearing BC-REP on the skills"
         }
      },
      {
         "id": "LSN-CON-02013#s3",
         "type": "strategy",
         "bands": [
            "low",
            "mid"
         ],
         "skills": [
            "BC-SKL-02036",
            "BC-SKL-02038"
         ],
         "sources": [
            "ced:67"
         ],
         "evidence_tag": "inferred",
         "archetype_id": "BC-QA-02008",
         "cue": "The stem asks for the derivative of the product or quotient, from a product or quotient of two differentiable expressions.",
         "method": "First written step: identify the two factors and their derivatives.",
         "rival": ".",
         "separating_feature": "A product gives two terms, each with one derivative."
      },
      {
         "id": "LSN-CON-02013#s4",
         "type": "strategy",
         "bands": [
            "low",
            "mid"
         ],
         "skills": [
            "BC-SKL-02037"
         ],
         "sources": [
            "ced:67"
         ],
         "evidence_tag": "inferred",
         "archetype_id": "BC-QA-02009",
         "cue": "The stem asks for the derivative value at the named input, from a table of values of two functions and their derivatives.",
         "method": "First written step: record the four supplied values at the named input.",
         "rival": "The rival is placing a function value where the rule calls for a derivative value.",
         "separating_feature": "Each of the four numbers is labelled a value or a derivative before it is used."
      },
      {
         "id": "LSN-CON-02013#s5",
         "type": "worked_example",
         "bands": [
            "low",
            "mid"
         ],
         "skills": [
            "BC-SKL-02036"
         ],
         "sources": [
            "ced:67"
         ],
         "evidence_tag": "inferred",
         "archetype_id": "BC-QA-02008",
         "parameter_draw": {
            "structure": "product of two polynomials",
            "first_factor": "x^2 + 1",
            "second_factor": "x^3 - 2x"
         },
         "problem": {
            "text": "Let \\(h(x)=(x^2+1)(x^3-2x)\\). Find \\(h'(x)\\).",
            "command_verb": "find"
         },
         "calculator_status": "no_calculator",
         "steps": [
            {
               "cue": "The stem is a product of \\(f=x^2+1\\) and \\(g=x^3-2x\\).",
               "why": "Each factor needs its own derivative: \\(f'=2x\\) and \\(g'=3x^2-2\\)."
            },
            {
               "cue": "Two factors are multiplied, so the rule is \\(f'g+fg'\\).",
               "why": "Both terms are needed. Each keeps one factor and differentiates the other.",
               "expression": [
                  "Add",
                  [
                     "Multiply",
                     [
                        "Multiply",
                        2,
                        "x"
                     ],
                     [
                        "Add",
                        [
                           "Power",
                           "x",
                           3
                        ],
                        [
                           "Multiply",
                           -2,
                           "x"
                        ]
                     ]
                  ],
                  [
                     "Multiply",
                     [
                        "Add",
                        [
                           "Power",
                           "x",
                           2
                        ],
                        1
                     ],
                     [
                        "Add",
                        [
                           "Multiply",
                           3,
                           [
                              "Power",
                              "x",
                              2
                           ]
                        ],
                        -2
                     ]
                  ]
               ],
               "point_type_id": "BC-PT-99022"
            },
            {
               "cue": "The stem asks for \\(h'(x)\\), so multiply out and collect terms.",
               "why": "Expanding first agrees: \\(x^5-x^3-2x\\) differentiates to \\(5x^4-3x^2-2\\).",
               "expression": [
                  "Add",
                  [
                     "Multiply",
                     5,
                     [
                        "Power",
                        "x",
                        4
                     ]
                  ],
                  [
                     "Multiply",
                     -3,
                     [
                        "Power",
                        "x",
                        2
                     ]
                  ],
                  -2
               ]
            }
         ],
         "answer": {
            "form": "symbolic",
            "mathjson": [
               "Add",
               [
                  "Multiply",
                  5,
                  [
                     "Power",
                     "x",
                     4
                  ]
               ],
               [
                  "Multiply",
                  -3,
                  [
                     "Power",
                     "x",
                     2
                  ]
               ],
               -2
            ]
         },
         "delivery": {
            "mode": "step_reveal",
            "reason": "rule 1"
         }
      },
      {
         "id": "LSN-CON-02013#s6",
         "type": "worked_example",
         "bands": [
            "low"
         ],
         "skills": [
            "BC-SKL-02036"
         ],
         "sources": [
            "ced:67"
         ],
         "evidence_tag": "inferred",
         "archetype_id": "BC-QA-02008",
         "parameter_draw": {
            "structure": "product with a transcendental factor",
            "first_factor": "x",
            "second_factor": "e^x"
         },
         "problem": {
            "text": "Let \\(h(x)=xe^x\\). Find \\(h'(x)\\).",
            "command_verb": "find"
         },
         "calculator_status": "no_calculator",
         "steps": [
            {
               "cue": "The stem is a product of \\(f=x\\) and \\(g=e^x\\).",
               "why": "Each factor needs its own derivative: \\(f'=1\\) and \\(g'=e^x\\)."
            },
            {
               "cue": "Two factors are multiplied, so the rule is \\(f'g+fg'\\).",
               "why": "The first term differentiates \\(f\\) and the second differentiates \\(g\\).",
               "expression": [
                  "Add",
                  [
                     "Multiply",
                     1,
                     [
                        "Exp",
                        "x"
                     ]
                  ],
                  [
                     "Multiply",
                     "x",
                     [
                        "Exp",
                        "x"
                     ]
                  ]
               ],
               "point_type_id": "BC-PT-99022"
            },
            {
               "cue": "Both terms contain \\(e^x\\).",
               "why": "Factoring out \\(e^x\\) gives a shorter form of the same derivative.",
               "expression": [
                  "Multiply",
                  [
                     "Add",
                     "x",
                     1
                  ],
                  [
                     "Exp",
                     "x"
                  ]
               ]
            }
         ],
         "answer": {
            "form": "symbolic",